{
  "$schema": "https://nitro.margelo.com/nitro.schema.json",
  "cxxNamespace": ["test"],
  "ios": {
    "iosModuleName": "NitroTest"
  },
  "android": {
    "androidNamespace": ["test"],
    "androidCxxLibName": "NitroTest"
  },
  "ignorePaths": [
    "**/node_modules"
  ],
  "gitAttributesGeneratedFlag": false
}
