{
  "$schema": "https://nitro.margelo.com/nitro.schema.json",
  "cxxNamespace": ["test", "external"],
  "ios": {
    "iosModuleName": "NitroTestExternal"
  },
  "android": {
    "androidNamespace": ["test", "external"],
    "androidCxxLibName": "NitroTestExternal"
  },
  "ignorePaths": [
    "**/node_modules"
  ]
}
