{
  "$schema": "https://nitro.margelo.com/nitro.schema.json",
  "cxxNamespace": [
    "$$cxxNamespace$$"
  ],
  "ios": {
    "iosModuleName": "$$iosModuleName$$"
  },
  "android": {
    "androidNamespace": [
      "$$androidNamespace$$"
    ],
    "androidCxxLibName": "$$androidCxxLibName$$"
  },
  "ignorePaths": [
    "**/node_modules"
  ]
}
